{
  "$schema": "https://json-schema.org/draft/2020-12/schema",
  "$id": "https://utopia.app/schemas/domain.v1.schema.json",
  "title": "Utopia domain package",
  "type": "object",
  "required": [
    "schema_version",
    "id",
    "label",
    "surfaces",
    "collections",
    "relations",
    "skills",
    "workflows",
    "data_homes",
    "mcp"
  ],
  "properties": {
    "$schema": {
      "type": "string"
    },
    "schema_version": {
      "const": "utopia.domain.v1"
    },
    "id": {
      "type": "string",
      "pattern": "^[a-z][a-z0-9_]*$"
    },
    "label": {
      "type": "string",
      "minLength": 1
    },
    "home_surface": {
      "type": "string"
    },
    "surfaces": {
      "type": "array",
      "minItems": 1,
      "items": {
        "type": "object",
        "required": [
          "id",
          "label",
          "collections"
        ],
        "properties": {
          "id": {
            "type": "string"
          },
          "label": {
            "type": "string"
          },
          "icon": {
            "type": "string"
          },
          "image_url": {
            "type": "string"
          },
          "views": {
            "type": "array",
            "items": {
              "type": "string"
            }
          },
          "collections": {
            "type": "array",
            "items": {
              "type": "string"
            }
          }
        },
        "additionalProperties": false
      }
    },
    "collections": {
      "type": "array",
      "items": {
        "type": "string"
      },
      "uniqueItems": true
    },
    "visual_identity": {
      "type": "object",
      "properties": {
        "domain": {
          "$ref": "#/$defs/visual_token"
        },
        "surfaces": {
          "$ref": "#/$defs/visual_token_map"
        },
        "collections": {
          "$ref": "#/$defs/visual_token_map"
        },
        "statuses": {
          "$ref": "#/$defs/visual_token_map"
        },
        "actions": {
          "$ref": "#/$defs/visual_token_map"
        },
        "sources": {
          "$ref": "#/$defs/visual_token_map"
        },
        "skills": {
          "$ref": "#/$defs/visual_token_map"
        },
        "agents": {
          "$ref": "#/$defs/visual_token_map"
        }
      },
      "additionalProperties": false
    },
    "relations": {
      "type": "array"
    },
    "skills": {
      "type": "array",
      "items": {
        "type": "string"
      },
      "uniqueItems": true
    },
    "workflows": {
      "type": "array",
      "items": {
        "type": "string"
      },
      "uniqueItems": true
    },
    "data_homes": {
      "type": "array",
      "items": {
        "enum": [
          "notion",
          "google_sheets",
          "sqlite",
          "postgres"
        ]
      },
      "uniqueItems": true
    },
    "dependency_pins": {
      "type": "array",
      "minItems": 1,
      "items": {
        "$ref": "#/$defs/dependency_pin"
      },
      "uniqueItems": true
    },
    "native_capabilities": {
      "$ref": "#/$defs/native_capability"
    },
    "rich_detail_schema": {
      "type": "string"
    },
    "provider_template_fields": {
      "type": "object",
      "properties": {
        "required": {
          "type": "array",
          "items": {
            "type": "string"
          },
          "uniqueItems": true
        },
        "rich_detail_json": {
          "type": "array",
          "items": {
            "type": "string"
          },
          "uniqueItems": true
        },
        "relations_json": {
          "type": "array",
          "items": {
            "type": "string"
          },
          "uniqueItems": true
        }
      },
      "additionalProperties": false
    },
    "render": {
      "type": "object",
      "properties": {
        "answer_label": {
          "type": "string"
        },
        "empty_intro": {
          "type": "string"
        },
        "default_title": {
          "type": "string"
        },
        "default_intro": {
          "type": "string"
        },
        "default_columns": {
          "type": "array",
          "items": {
            "type": "string"
          }
        },
        "default_fields": {
          "type": "array",
          "items": {
            "type": "string"
          }
        },
        "card_bullets": {
          "type": "array",
          "items": {
            "type": "string"
          }
        },
        "source_quote_fields": {
          "type": "array",
          "items": {
            "type": "string"
          }
        },
        "source_exclude_fields": {
          "type": "array",
          "items": {
            "type": "string"
          }
        },
        "intents": {
          "type": "object",
          "additionalProperties": {
            "type": "object",
            "properties": {
              "terms": {
                "type": "array",
                "items": {
                  "type": "string"
                }
              },
              "title": {
                "type": "string"
              },
              "intro": {
                "type": "string"
              },
              "columns": {
                "type": "array",
                "items": {
                  "type": "string"
                }
              },
              "fields": {
                "type": "array",
                "items": {
                  "type": "string"
                }
              },
              "boost_collections": {
                "type": "array",
                "items": {
                  "type": "string"
                }
              }
            },
            "additionalProperties": false
          }
        }
      },
      "additionalProperties": false
    },
    "mcp": {
      "type": "object",
      "required": [
        "resources",
        "tools"
      ]
    },
    "ui": {
      "$ref": "#/$defs/package_ui"
    }
  },
  "$defs": {
    "visual_token": {
      "type": "object",
      "properties": {
        "icon": {
          "type": "string"
        },
        "emoji": {
          "type": "string"
        },
        "image_url": {
          "type": "string"
        },
        "accent": {
          "enum": [
            "neutral",
            "moss",
            "amber",
            "plum",
            "blue"
          ]
        }
      },
      "additionalProperties": false
    },
    "visual_token_map": {
      "type": "object",
      "additionalProperties": {
        "$ref": "#/$defs/visual_token"
      }
    },
    "native_permission": {
      "type": "object",
      "required": [
        "id",
        "platform",
        "permission",
        "reason"
      ],
      "properties": {
        "id": {
          "type": "string",
          "pattern": "^[A-Za-z0-9][A-Za-z0-9_.:-]*$"
        },
        "platform": {
          "enum": [
            "expo",
            "android",
            "ios",
            "web",
            "macos"
          ]
        },
        "permission": {
          "type": "string",
          "minLength": 1
        },
        "reason": {
          "type": "string",
          "minLength": 1
        },
        "required": {
          "type": "boolean"
        },
        "prompt": {
          "type": "string",
          "minLength": 1
        }
      },
      "additionalProperties": false
    },
    "native_intent": {
      "type": "object",
      "required": [
        "id",
        "platform",
        "kind",
        "reason"
      ],
      "properties": {
        "id": {
          "type": "string",
          "pattern": "^[A-Za-z0-9][A-Za-z0-9_.:-]*$"
        },
        "platform": {
          "enum": [
            "expo",
            "android",
            "ios",
            "web",
            "macos"
          ]
        },
        "kind": {
          "enum": [
            "share",
            "deep_link",
            "shortcut",
            "voice",
            "background_task",
            "file_open",
            "url_open"
          ]
        },
        "reason": {
          "type": "string",
          "minLength": 1
        },
        "required": {
          "type": "boolean"
        },
        "payload": {
          "type": "object"
        }
      },
      "additionalProperties": false
    },
    "dependency_pin": {
      "type": "object",
      "required": [
        "package",
        "version"
      ],
      "properties": {
        "package": {
          "type": "string",
          "minLength": 1
        },
        "version": {
          "type": "string",
          "minLength": 1
        },
        "source": {
          "enum": [
            "npm",
            "maven",
            "gradle",
            "cocoapods",
            "other"
          ]
        }
      },
      "additionalProperties": false
    },
    "native_capability": {
      "type": "object",
      "required": [
        "schemaVersion",
        "platform",
        "packages"
      ],
      "properties": {
        "schemaVersion": {
          "const": "wonder.app-package-native-capabilities.v1"
        },
        "platform": {
          "enum": [
            "expo",
            "android",
            "ios",
            "web",
            "macos"
          ]
        },
        "packages": {
          "type": "array",
          "minItems": 1,
          "items": {
            "type": "string",
            "minLength": 1
          },
          "uniqueItems": true
        },
        "permissions": {
          "type": "array",
          "items": {
            "oneOf": [
              {
                "type": "string",
                "minLength": 1
              },
              {
                "$ref": "#/$defs/native_permission"
              }
            ]
          }
        },
        "intents": {
          "type": "array",
          "items": {
            "$ref": "#/$defs/native_intent"
          },
          "uniqueItems": true
        }
      },
      "additionalProperties": false
    },
    "package_ui_action": {
      "type": "object",
      "required": [
        "kind"
      ],
      "properties": {
        "kind": {
          "enum": [
            "open_url",
            "propose"
          ]
        },
        "label": {
          "type": "string"
        },
        "url": {
          "type": "string"
        },
        "command": {
          "type": "string",
          "pattern": "^[a-z][a-z0-9_]*$"
        },
        "tool": {
          "type": "string",
          "pattern": "^[a-z][a-z0-9_]*$"
        },
        "payload": {
          "type": "object"
        }
      },
      "additionalProperties": false,
      "allOf": [
        {
          "if": {
            "properties": {
              "kind": {
                "const": "open_url"
              }
            },
            "required": [
              "kind"
            ]
          },
          "then": {
            "required": [
              "url"
            ]
          }
        },
        {
          "if": {
            "properties": {
              "kind": {
                "const": "propose"
              }
            },
            "required": [
              "kind"
            ]
          },
          "then": {
            "anyOf": [
              {
                "required": [
                  "command"
                ]
              },
              {
                "required": [
                  "tool"
                ]
              }
            ]
          }
        }
      ]
    },
    "package_ui_component": {
      "type": "object",
      "required": [
        "kind"
      ],
      "properties": {
        "kind": {
          "enum": [
            "recordList",
            "metric",
            "action",
            "text",
            "widget"
          ]
        },
        "widget": {
          "enum": [
            "assistantChat",
            "healthConnect",
            "schemaEditor",
            "widgetCatalog",
            "postCard",
            "pollCard",
            "linkPreview",
            "feedList",
            "kanbanBoard",
            "smartCapture",
            "chartBlock",
            "mediaBlock",
            "videoPlayer",
            "cameraScanner",
            "mapBlock",
            "locationMap",
            "sensorReadout",
            "formCard",
            "checklistCard",
            "calendarBlock",
            "notificationScheduler",
            "contactPicker",
            "calendarEvent",
            "biometricGate",
            "healthKitStatus",
            "speechTool",
            "timelineBlock",
            "galleryGrid",
            "dataTable",
            "permissionCard",
            "capabilityExerciser",
            "filePicker",
            "fileExport",
            "providerStatus",
            "themePreview",
            "themeDensitySelector",
            "aiProviderSettings",
            "dataHomeSettings",
            "scientificCalculator",
            "audioLoopPlayer",
            "stepFlow",
            "durationTimer",
            "valueControl",
            "operationHistory",
            "quickAddList",
            "structuredList",
            "groupedRecordShelf",
            "recordHeroSummary",
            "horizontalRecordCarousel",
            "recordTimeline",
            "recordContentCard",
            "recordReviewCard",
            "askFoodBar"
          ]
        },
        "props": {
          "type": "object"
        },
        "id": {
          "type": "string"
        },
        "title": {
          "type": "string",
          "minLength": 1
        },
        "subtitle": {
          "type": "string"
        },
        "view": {
          "type": "string"
        },
        "tone": {
          "enum": [
            "neutral",
            "moss",
            "amber",
            "plum",
            "blue"
          ]
        },
        "placement": {
          "enum": [
            "inline",
            "top",
            "fab"
          ]
        },
        "query": {
          "type": "object",
          "properties": {
            "collections": {
              "type": "array",
              "items": {
                "type": "string",
                "minLength": 1
              },
              "uniqueItems": true
            },
            "match": {
              "type": "string"
            },
            "limit": {
              "type": "integer",
              "minimum": 1,
              "maximum": 200
            }
          },
          "additionalProperties": false
        },
        "dataBinding": {
          "oneOf": [
            {
              "type": "object",
              "required": ["source", "xField", "yField"],
              "properties": {
                "source": { "const": "query-records" },
                "xField": { "type": "string", "minLength": 1 },
                "yField": { "type": "string", "minLength": 1 }
              },
              "additionalProperties": false
            },
            {
              "type": "object",
              "required": ["source", "aggregate"],
              "properties": {
                "source": { "const": "query-aggregate" },
                "aggregate": { "enum": ["count", "sum", "avg", "min", "max"] },
                "valueField": { "type": "string", "minLength": 1 },
                "groupBy": { "type": "string", "minLength": 1 },
                "labelField": { "type": "string", "minLength": 1 }
              },
              "additionalProperties": false
            }
          ]
        },
        "dataState": {
          "enum": ["loading", "ready", "error"]
        },
        "dataError": {
          "type": "string",
          "minLength": 1
        },
        "action": {
          "$ref": "#/$defs/package_ui_action"
        }
      },
      "additionalProperties": false
    },
    "package_ui_screen": {
      "type": "object",
      "required": [
        "components"
      ],
      "properties": {
        "title": {
          "type": "string"
        },
        "subtitle": {
          "type": "string"
        },
        "shell": {
          "type": "object"
        },
        "components": {
          "type": "array",
          "minItems": 1,
          "items": {
            "$ref": "#/$defs/package_ui_component"
          }
        }
      },
      "additionalProperties": false
    },
    "package_ui": {
      "type": "object",
      "properties": {
        "schemaVersion": {
          "const": "a2ui.v0_9"
        },
        "localization": {
          "$ref": "#/$defs/package_ui_localization"
        },
        "openUrlAllowlist": {
          "type": "array",
          "items": {
            "type": "string"
          }
        },
        "navigation": {
          "type": "object",
          "required": [
            "items"
          ],
          "properties": {
            "items": {
              "type": "array",
              "minItems": 1,
              "maxItems": 5,
              "items": {
                "type": "object",
                "required": [
                  "screen",
                  "label"
                ],
                "properties": {
                  "screen": {
                    "type": "string",
                    "minLength": 1
                  },
                  "label": {
                    "type": "string",
                    "minLength": 1
                  },
                  "icon": {
                    "type": "string",
                    "minLength": 1
                  }
                },
                "additionalProperties": false
              }
            }
          },
          "additionalProperties": false
        },
        "components": {
          "type": "array",
          "minItems": 1,
          "items": {
            "$ref": "#/$defs/package_ui_component"
          }
        },
        "screens": {
          "type": "object",
          "additionalProperties": {
            "$ref": "#/$defs/package_ui_screen"
          }
        },
        "defaultScreen": {
          "type": "string"
        }
      },
      "additionalProperties": false
    },
    "package_ui_localization": {
      "type": "object",
      "required": [
        "defaultLocale",
        "messages"
      ],
      "properties": {
        "defaultLocale": {
          "type": "string",
          "pattern": "^[A-Za-z]{2,8}(-[A-Za-z0-9]{1,8})*$"
        },
        "fallbackLocale": {
          "type": "string",
          "pattern": "^[A-Za-z]{2,8}(-[A-Za-z0-9]{1,8})*$"
        },
        "appLocale": {
          "type": "string",
          "pattern": "^[A-Za-z]{2,8}(-[A-Za-z0-9]{1,8})*$"
        },
        "messages": {
          "type": "object",
          "minProperties": 1,
          "additionalProperties": {
            "type": "object",
            "minProperties": 1,
            "additionalProperties": {
              "type": "string",
              "minLength": 1
            }
          }
        }
      },
      "additionalProperties": false
    }
  },
  "additionalProperties": false
}
